{"clientRequestId":"interop-probe-0001","task":"Summarise the synthetic coverage clause for evaluation.","tokenBudget":512,
 "documents":[{"id":"syn-doc-1","title":"Synthetic clause A","text":"Alpha beta gamma delta epsilon. Coverage category B applies to synthetic case 0001."},
              {"id":"syn-doc-2","title":"Synthetic clause B","text":"Zeta eta theta iota kappa. Exclusions do not apply to synthetic case 0001."}]}
